[
  {
    "id": "dev.kami.hash-compute",
    "name": "hash-compute",
    "version": "0.1.0",
    "description": "Compute SHA-256 or SHA-512 hash of any text",
    "source": "Hypijump31/kami-plugins@v0.1.0",
    "download_url": "https://github.com/Hypijump31/kami-plugins/releases/download/v0.1.0/hash-compute.zip",
    "wasm_sha256": "9d09a29d28cdbabd8a53df6d83570bada5027bf75294ff5fb162747204739d0f",
    "signature": "0bd370dc76919074a9dff5f3d7ea63bebb25394cf37ae2f1516ea8683d80e9e631bdc2fc58f9e28a192a49092d50103e0386d83a2a7d85f60ab0934db08f9f09",
    "signer_public_key": "6cd878f91272444016df3548e4149b1ab64984ed724b5752ab533082e4af0fd5"
  },
  {
    "id": "dev.kami.base64-codec",
    "name": "base64-codec",
    "version": "0.1.0",
    "description": "Encode or decode Base64 (standard and URL-safe variants)",
    "source": "Hypijump31/kami-plugins@v0.1.0",
    "download_url": "https://github.com/Hypijump31/kami-plugins/releases/download/v0.1.0/base64-codec.zip",
    "wasm_sha256": "781f36f7a6b3b052cac155f426d4a55066c0da85f383f6aa07e183f7381895c7",
    "signature": "8a37f59ba8921af0ab71d8404d6b3dd3e05cab2d9a6fc033a08aad7480f32268b0258bfac22e53b75d090206ac21d21ecb4d11cf654e2868886d1d93a3c55b02",
    "signer_public_key": "6cd878f91272444016df3548e4149b1ab64984ed724b5752ab533082e4af0fd5"
  },
  {
    "id": "dev.kami.regex-extract",
    "name": "regex-extract",
    "version": "0.1.0",
    "description": "Extract regex capture groups from text (supports multiple matches)",
    "source": "Hypijump31/kami-plugins@v0.1.0",
    "download_url": "https://github.com/Hypijump31/kami-plugins/releases/download/v0.1.0/regex-extract.zip",
    "wasm_sha256": "e7a99b0dac7ee5ce3ca484158931cff308e004dbff2720c1d9b3b873ab66b6fd",
    "signature": "6e78e815ceeac4176c888e399ce8d3de17e4a9382b9884bf34785f69b4a6645836a12ece37de1be21d74424976c78b9c9c34fa343803a4c8d1d82f16bca1b30a",
    "signer_public_key": "6cd878f91272444016df3548e4149b1ab64984ed724b5752ab533082e4af0fd5"
  },
  {
    "id": "dev.kami.json-query",
    "name": "json-query",
    "version": "0.1.0",
    "description": "Transform JSON objects: pick keys, merge, sort, flatten, extract keys/values",
    "source": "Hypijump31/kami-plugins@v0.1.0",
    "download_url": "https://github.com/Hypijump31/kami-plugins/releases/download/v0.1.0/json-query.zip",
    "wasm_sha256": "56b0749f10162a70761868d906f7a6301cfd243c80950697acdff0d9e912d82d",
    "signature": "cab38ed37a5661f81f8008b671a554112b753e35f173adc9c30fbb642f34db799f9f5850f5c53317cde46003092d096e20c8a95f0c18caf2b17f60c369ca3200",
    "signer_public_key": "6cd878f91272444016df3548e4149b1ab64984ed724b5752ab533082e4af0fd5"
  },
  {
    "id": "dev.kami.text-transform",
    "name": "text-transform",
    "version": "0.1.0",
    "description": "Transform text: case conversion, slugify, truncate, word count, and more",
    "source": "Hypijump31/kami-plugins@v0.1.0",
    "download_url": "https://github.com/Hypijump31/kami-plugins/releases/download/v0.1.0/text-transform.zip",
    "wasm_sha256": "ddb142619ac88589fcfc5cddc3bc3ad23b52b8feb83427397a62ab847e86d5d4",
    "signature": "843c62d60c157a35a2c8cac6df152b27c68333091ca50014d69f8e558e1fba34ceeaca40ef5a32fa0066dadb6b77d0306f7302ef85b55e9cebe85454fae5e20f",
    "signer_public_key": "6cd878f91272444016df3548e4149b1ab64984ed724b5752ab533082e4af0fd5"
  },
  {
    "id": "dev.kami.csv-query",
    "name": "csv-query",
    "version": "0.1.0",
    "description": "Parse CSV data and filter rows or select columns",
    "source": "Hypijump31/kami-plugins@v0.1.0",
    "download_url": "https://github.com/Hypijump31/kami-plugins/releases/download/v0.1.0/csv-query.zip",
    "wasm_sha256": "47847ebdc644114608fd381d9a8e7bb3bb0e87b0c3d1d54aabd0d82101918423",
    "signature": "da444dda28604f5c8c05920be17115f817df683e69b980f5ae591e65019c47dd6f332ad7c739e69af4eef65dc3ff577d482f2d82b3abf43722ef023fe94d100a",
    "signer_public_key": "6cd878f91272444016df3548e4149b1ab64984ed724b5752ab533082e4af0fd5"
  },
  {
    "id": "dev.kami.jwt-decode",
    "name": "jwt-decode",
    "version": "0.1.0",
    "description": "Decode a JWT token and inspect its header, payload, and claims (read-only, no signature verification)",
    "source": "Hypijump31/kami-plugins@v0.1.0",
    "download_url": "https://github.com/Hypijump31/kami-plugins/releases/download/v0.1.0/jwt-decode.zip",
    "wasm_sha256": "1156d8e7892c8b0f455e5856c50b17157c17a2d1358951b2c884e6a17c37ff9c",
    "signature": "011e53a8ae181a652004649db58de34659d6be8ca5d7ccde851737c7bd5a9aa373afef257a536a21ea65089f8ed900f641d41d8dbe8211414b91bf3a2c77590d",
    "signer_public_key": "6cd878f91272444016df3548e4149b1ab64984ed724b5752ab533082e4af0fd5"
  },
  {
    "id": "dev.kami.url-parse",
    "name": "url-parse",
    "version": "0.1.0",
    "description": "Parse URL components: scheme, host, port, path, query parameters, fragment",
    "source": "Hypijump31/kami-plugins@v0.1.0",
    "download_url": "https://github.com/Hypijump31/kami-plugins/releases/download/v0.1.0/url-parse.zip",
    "wasm_sha256": "8275b2cb6b3a0528e36dd74f881b75f2d6ce230109a95820c7e50ef00d0af48e",
    "signature": "41c145580a264ff3d03337c2301f83c70c01f8d4b0f45124ee181522dca6d86470569353a69f9db75c684c4547f49ad7b1678ce03dc07d463d44effc4b47940e",
    "signer_public_key": "6cd878f91272444016df3548e4149b1ab64984ed724b5752ab533082e4af0fd5"
  },
  {
    "id": "dev.kami.text-diff",
    "name": "text-diff",
    "version": "0.1.0",
    "description": "Compare two texts and return added/removed/unchanged tokens (line, word, or char level)",
    "source": "Hypijump31/kami-plugins@v0.1.0",
    "download_url": "https://github.com/Hypijump31/kami-plugins/releases/download/v0.1.0/text-diff.zip",
    "wasm_sha256": "9c11f5d0f04f1a453df8f94c5747f4f2f6d980a7a7c825d539f5c3a46e577930",
    "signature": "df5e05aa092b81dacca6762f326f12be162accf220506446915af652ab6a537cbb0047c333ad553a386bb116199bad20c39d03028e79ca94d402e5e7cbefcb0c",
    "signer_public_key": "6cd878f91272444016df3548e4149b1ab64984ed724b5752ab533082e4af0fd5"
  },
  {
    "id": "dev.kami.markdown-to-html",
    "name": "markdown-to-html",
    "version": "0.1.0",
    "description": "Convert Markdown to HTML with optional GFM extensions (tables, strikethrough, task lists)",
    "source": "Hypijump31/kami-plugins@v0.1.0",
    "download_url": "https://github.com/Hypijump31/kami-plugins/releases/download/v0.1.0/markdown-to-html.zip",
    "wasm_sha256": "c9d2bb1bdd97447b6e47bf78feb29d2aab4f264c59416d3c59803607499e8ec4",
    "signature": "15afcab0b84d238d785e0fda98a5172d3feb10bfa601dbf4bb789ba691adabbfa93455851dc318c4abc98bf3b2954135ab740e82689f23c6f6e1a1e5ca57ae08",
    "signer_public_key": "6cd878f91272444016df3548e4149b1ab64984ed724b5752ab533082e4af0fd5"
  }
]
